{
  "schema_version": "intel_bootstrap.v1",
  "generated_at": "2026-08-30T08:00:00Z",
  "map": {"systems": [{"name": "Jita", "system_name": "Jita", "hostile_count": 2}], "summary": {"system_count": 1, "alert_count": 1}},
  "alerts": [{"id": "evt_1", "system_name": "Jita", "system_id": 30000142, "level": "high", "score": 80, "hostile_count": 2, "created_at": "2026-08-30T07:59:00Z"}],
  "active_intel": [{"id": "ocr:1", "system_name": "Jita", "active": true}],
  "clients": {"heartbeats": []},
  "monitoring_nodes": [{"client_id": "detector:1", "system_name": "Jita"}],
  "monitoring_nodes_version": "nodes-v1",
  "monitoring_node_changes": []
}
